review_id,review_text
1,"Absolutely love these shoes, super comfortable and stylish."
2,They look great but hurt my feet after an hour.
3,"Best sneakers I've owned, worth every dollar."
4,The quality feels cheap and they started creasing immediately.
5,"Perfect for walking all day, no complaints at all."
6,"Sizing runs small, had to return them."
7,Colorway is amazing and matches everything I wear.
8,"Not breathable at all, my feet get sweaty fast."
9,Great support for the gym and casual wear.
10,Laces feel flimsy and came apart in a week.
11,Super lightweight and comfy.
12,Overpriced for what you get.
13,I get compliments every time I wear them.
14,The sole started separating after a month.
15,"Excellent cushioning, feels like walking on clouds."
16,Design is cool but durability is questionable.
17,True to size and very comfortable.
18,"Blisters on the first wear, disappointed."
19,"Solid everyday shoe, very reliable."
20,"Material stains easily, hard to clean."
21,"Love the retro vibe, totally my style."
22,Arch support is lacking for long walks.
23,"Great traction, even on wet surfaces."
24,"They squeak when I walk, annoying."
25,Fantastic build quality and stitching.
26,Too narrow for my feet.
27,Good balance of comfort and style.
28,They faded faster than expected.
29,My new favorite pair of shoes.
30,"Would not buy again, not impressed."
